{
  "schema_version": "1.0.0",
  "result_kind": "placeholder_sample",
  "is_placeholder": true,
  "claims_allowed": false,
  "generated_at": "2026-01-01T00:00:00.000Z",
  "disclaimer": "This file contains deterministic placeholder sample data for visual-agent wiring only. These are not benchmark results and must not be used as performance claims.",
  "methodology": "docs/benchmarks/methodology.md",
  "competitors": [
    "@sebasoft/neuron-js",
    "json-rules-engine",
    "json-logic-js",
    "hand-coded-typescript",
    "rule-engine-js"
  ],
  "scenarios": ["pricing-discount", "eligibility-approval", "workflow-routing"],
  "input_sizes": ["smoke", "small", "medium", "large"],
  "results": [
    {
      "engine": "@sebasoft/neuron-js",
      "scenario": "pricing-discount",
      "input_size": "smoke",
      "warmup_iterations": 10,
      "measured_iterations": 100,
      "throughput_decisions_per_second": 1000,
      "p50_ms": 1,
      "p95_ms": 2,
      "cold_start_ms": 25,
      "bundle_size_minified_bytes": 5000,
      "validation_overhead_ms": 0.5,
      "explanation_overhead_ms": 0.75,
      "node_version": "v0.0.0-placeholder",
      "package_version": "0.0.0-placeholder",
      "commit_sha": "0000000000000000000000000000000000000000",
      "result_kind": "placeholder_sample",
      "notes": "synthetic placeholder row for chart wiring only; not benchmark results and not a performance claim."
    },
    {
      "engine": "json-rules-engine",
      "scenario": "eligibility-approval",
      "input_size": "smoke",
      "warmup_iterations": 10,
      "measured_iterations": 100,
      "throughput_decisions_per_second": 1001,
      "p50_ms": 1.1,
      "p95_ms": 2.1,
      "cold_start_ms": 26,
      "bundle_size_minified_bytes": 5001,
      "validation_overhead_ms": 0.6,
      "explanation_overhead_ms": 0.85,
      "node_version": "v0.0.0-placeholder",
      "package_version": "0.0.0-placeholder",
      "commit_sha": "0000000000000000000000000000000000000000",
      "result_kind": "placeholder_sample",
      "notes": "synthetic placeholder row for chart wiring only; not benchmark results and not a performance claim."
    },
    {
      "engine": "json-logic-js",
      "scenario": "workflow-routing",
      "input_size": "smoke",
      "warmup_iterations": 10,
      "measured_iterations": 100,
      "throughput_decisions_per_second": 1002,
      "p50_ms": 1.2,
      "p95_ms": 2.2,
      "cold_start_ms": 27,
      "bundle_size_minified_bytes": 5002,
      "validation_overhead_ms": 0.7,
      "explanation_overhead_ms": 0.95,
      "node_version": "v0.0.0-placeholder",
      "package_version": "0.0.0-placeholder",
      "commit_sha": "0000000000000000000000000000000000000000",
      "result_kind": "placeholder_sample",
      "notes": "synthetic placeholder row for chart wiring only; not benchmark results and not a performance claim."
    },
    {
      "engine": "hand-coded-typescript",
      "scenario": "pricing-discount",
      "input_size": "smoke",
      "warmup_iterations": 10,
      "measured_iterations": 100,
      "throughput_decisions_per_second": 1003,
      "p50_ms": 1.3,
      "p95_ms": 2.3,
      "cold_start_ms": 28,
      "bundle_size_minified_bytes": 5003,
      "validation_overhead_ms": 0.8,
      "explanation_overhead_ms": 1.05,
      "node_version": "v0.0.0-placeholder",
      "package_version": "0.0.0-placeholder",
      "commit_sha": "0000000000000000000000000000000000000000",
      "result_kind": "placeholder_sample",
      "notes": "synthetic placeholder row for chart wiring only; not benchmark results and not a performance claim."
    },
    {
      "engine": "rule-engine-js",
      "scenario": "eligibility-approval",
      "input_size": "smoke",
      "warmup_iterations": 10,
      "measured_iterations": 100,
      "throughput_decisions_per_second": 1004,
      "p50_ms": 1.4,
      "p95_ms": 2.4,
      "cold_start_ms": 29,
      "bundle_size_minified_bytes": 5004,
      "validation_overhead_ms": 0.9,
      "explanation_overhead_ms": 1.15,
      "node_version": "v0.0.0-placeholder",
      "package_version": "0.0.0-placeholder",
      "commit_sha": "0000000000000000000000000000000000000000",
      "result_kind": "placeholder_sample",
      "notes": "synthetic placeholder row for chart wiring only; not benchmark results and not a performance claim."
    }
  ]
}
